overall,vote,verified,reviewTime,reviewerID,asin,reviewerName,reviewText,summary,unixReviewTime,image,style
2,12,False,"09 22, 2016",A1IDMI31WEANAF,0020232233,Mackenzie Kent,"When it comes to a DM's screen, the space on the screen itself is at an absolute premium. The fact that 50% of this space is wasted on art (and not terribly informative or needed art as well) makes it completely useless. The only reason that I gave it 2 stars and not 1 was that, technically speaking, it can at least still stand up to block your notes and dice rolls. Other than that, it drops the ball completely.",The fact that 50% of this space is wasted on art (and not terribly informative or needed art ...,1474502400,,
1,21,False,"09 18, 2016",A4BCEVVZ4Y3V3,0020232233,Jonathan Christian,"An Open Letter to GaleForce9*:

Your unpainted miniatures are very not bad. Your spell cards are great. Your board games are ""meh"". Your DM screens, however, are freaking terrible. I'm still waiting for a single screen that isn't polluted with pointless artwork where useful, reference-able tables should be. Once again, you've created a single use screen that is only useful when running the ""Storm King's Thunder"" adventure. Even despite the fact that it's geared to that adventure path, it's usefulness negligible, at best. I massive swath of the inner panel is wasted on artwork and a bloated overland map, which could have been easily reduced to a single panel in size. And the few table you have are nigh-useless themselves.

In short, stop making crap DM screens.",Another worthless Dungeon Master's screen from GaleForce9,1474156800,,
3,19,True,"09 12, 2016",A2EZ9PY1IHHBX0,0020232233,unpreparedtodie,"Nice art, nice printing.  Why two panels are filled with a general Forgotten Realms map is beyond me.  Most of one of them is all blue ocean.  Such a waste.

I don't understand why they can't make these DM Screens more useful for these ""kinds of adventures"" rather than solely the specific adventure.  You're supposed to be able to transpose this adventure to other lands outside the Forgotten Realms.  So even just a list of new monsters or NPCs would at least be useful than the map.  Even more would just be stuff related to running the game but broad-use stuff related to giants.

Same thing with Curse of Strahd.  Why not make it useful for raven loft, undead or horror campaigns in general... instead a huge amount of screen space is solely mapping out Castle Ravenloft, which is only useful during a small fraction of the time even for the Curse of Strahd adventure, let alone various other Ravenloft adventuring.

They really kill the extended use of these screens by not thinking about their potential use, both for the adventure in question, as well as use in a broader sense.

The Rage of Demons screen is far more useful for broad under dark adventuring - covering a lot of rules for the various conditions you may suffer... and the map is only one panel.

This Storm Giants one is decent for a few tables it includes - but really misses the mark.  Maybe they should ask a few DMs what they would use?","pretty, but also pretty useless",1473638400,,
5,,True,"03 2, 2017",A139PXTTC2LGHZ,0020232233,Ashley,Amazing buy! Bought it as a gift for our new dm and it's perfect!,Five Stars,1488412800,,
1,3,True,"02 8, 2017",A3IB33V29XIL8O,0020232233,Oghma_EM,"As my review of GF9's previous screens these were completely unnecessary and nearly useless. Skip them, this is the definition of a waste of money.",Money trap,1486512000,,
5,,True,"01 27, 2017",A1J86V48S4KRJE,0020232233,Cynthia A. Evoniuk,Grandson loves,Five Stars,1485475200,,
5,,False,"01 2, 2017",A14J12PRBLGHF4,0020232233,Amazon Customer,"I have bought many gm screens over the years, but this one is the best I have ever seen. It has all the relevant information I need , and no crap filler on it. Very happy with this screen.",Best gm screen ever,1483315200,,
5,,True,"12 17, 2016",A2UKOWP9ICU416,0020232233,anon9df0,Came in perfect condition.,Five Stars,1481932800,,
4,,False,"12 15, 2016",A2ONKKDETRWT79,0020232233,Consumer Dad,Could be better but its still great. I love the things on the DM's side of the screen and I actually like the map in the middle makes it easy to reference whats around at any given time.,Great but could be even better,1481760000,,
3,13,True,"12 9, 2016",AK9GN9KZZNTEP,0020232233,Dallas Gamer Family,"My review will mirror others in that this kind of misses the mark and there are some lost opportunities to help DM's.  I wouldn't advise new DM's to use this by itself.  They should stick to the generic 5e DM screen and just copy/print the other useful information for SKT.
I do like that the information they did put in the screen was relevant to the game and makes accessible some of the frequently visited tables from the adventure book.  I also like the map from the perspective that it contains the page references to the cities and locations. This is pretty useful, especially during Ch 3 of the adventure.
However, there is a very Large amount of wasted space that could easily have been utilized instead of having the whole map take up 2 panels of the screen. The middle of the ocean could have contained info on the Giant hierarchy, the Giant Rune symbols, the Random encounters at Sea table from the DMG, trap tables, or any number of other usefully applicable information to the story.  I would have done away with the Sea portion of the map completely and used that space more efficiently.  In all actuality, the entire map could have been an extra insert, freeing up far more space and making this product far more appealing...or the Adventure book could have included it as a tear out.  There should have been better collaboration on this product.
On a different note, the printing on my copy of the screen was not sized correctly.  The Left and right creases are right over the edge of the words...especially on the Right side.  It is almost illegible when the screen is up and in it's general position at the gaming table.(See attached pic)

I can understand the idea and desire to produce tailored DM Screens for these adventure books, but I don't feel they've truly taken the time to get feedback on their ideas from enough sources before printing. It's coming across as licensed money grab instead of a Value Add product to the adventure line.",Another missed opportunity.  Not a value add to the product line.,1481241600,"['https://images-na.ssl-images-amazon.com/images/I/718LAfAbT2L._SY88.jpg', 'https://images-na.ssl-images-amazon.com/images/I/718LAfAbT2L._SY88.jpg']",
5,,True,"12 7, 2016",A26HO01PDWN6O5,0020232233,Amazon Customer,Works very well,Five Stars,1481068800,,
5,,True,"11 5, 2016",A8PF4X87CS3ZZ,0020232233,B. Felkins,Can't wait to use it!,Love the map!,1478304000,,
5,2,False,"11 4, 2016",A28QGCUNS22JPH,0020232233,Daniel Gabriel Horton,This is a campaign specific DM screen meant to work with The Storm Kings Thunder adventure.  It is not a general use screen.  The reason I'm  giving it 5 stars is that every named place on the map also has the page number of locations entry in TSKT. That feature has saved me time in Adventures League play. Other AL DMs will tell you how precious every minute is in the standard 2 hour format.,Not a general DM screen,1478217600,,
2,3,False,"04 24, 2017",A2X2RJWNAV4FM0,038536539X,J Person,"This is one of the worst games I have ever played.  You basically have to come up with puns on the spot.  Not only are puns generally pretty bad, you have to generate puns that are worse than your run of the mill groaners.  I can't imagine many people enjoying it, but it is slow paced and generally does not generate any level of enjoyment unless you're very skilled with the English language.",Very weak game,1492992000,,
2,6,True,"04 17, 2017",A1DIRJ8YNI5TKL,038536539X,ZacWolf,"It sounded like a really amazing concept, but when we tried to play it, it fell completely flat. Maybe if we were fans of the television show that the game is originally based upon? But having no ""prior experience"", we tried three rounds (even using the ""hints"" to get people started) and everyone just looked at each other and we decided to play something else. This was a high IQ group, and we often use puns in day to day banter, but the game just fell completely flat. :-(

Sad, because the quality of the box set is very nice, and comes with everything needed to play (pads, pencils, etc.).",Fell completely flat...,1492387200,,
5,,True,"01 26, 2017",A2G5IDD919P2DK,038536539X,Marcy A. Danenmann,Very fun game for my family,Five Stars,1485388800,,
4,13,False,"03 16, 2004",AGCAAWP1AVVZR,0486277577,M. P. Schiesl,"Pretty good book with a variety of unique card sleights (palming, manipulating cards in the deck, etc.). These sleights are the 'real work', so it will take a little perseverance. Many of these utility sleights are ones that you ought to know if you want to be a card sleight-of-hand worker.
The instructions are generally clear, but sometimes a detail here and there gets a little confusing. There's a fair number of photos showing how to do many of the sleights.
Sometimes a sleight is a little more complicated than it needs to be. My recommendation is to follow the author's steps in slow-motion with a deck of cards in hand. After you are familiar with the overall effect, you can make adjustments based on what your comfortable with. There may also be other newer methods for learning these sleights if you want to invest in newer card sleight instruction (such as the Daryl Encyclopedia of Card Sleights videos, etc.).
Right now, I'm working on the side steal sleight. He gives a T. Nelson Downs version which has some merit, but it is much more complicated than necessary. The author's own version is a little more do-able. But even the author's method becomes a little too fidgety, so I've made minor modifications to make it work well for me. I start in slow-motion, counting through the substeps to keep pace while I do the move (1..2..3..4). Then I repeat it until I can bring it up to full speed.
If you want to learn sleights for cheap, try this book. You may have to pick and choose through the sleights, and there may be better methods to perform some of these sleights now, but it's not bad for under $10.",Good book,1079395200,,{'Format:': ' Paperback'}
5,16,False,"04 28, 2002",AD2CIUI4TSVY7,0486277577,Mark Thomas,"When I unexpectedly came across a picture of Buckley on the first page of the book, and after hearing the other reviews of how difficult and advanced the techniques in the book were, I couldn't believe my eyes. I was surprised to see the face of a handsome teenager, of which my previous impression was COMPLETELY the opposite to the one I held in my hands. And this guy was a professional card magician at the age of 18, and able to do tricks infront of hundreds of people on-stage in 1908!
I have a feeling that this guy's mystery and skill probably gained him significant success with girls his age. The mysterious effects of these difficult to execute sleights are priceless and dazzling beyond belief. If a 3 columns card trick can make girls believe in magic.. then Buckley's stuff probably knocked their socks off... literally! Believe me, this guy would be able to blow David Blaine out of the water and make him look like Bob Longe.
That being said and out of the way, the book itself is amazing. There are very clearcut photos of Buckley's hands and very impressive card tricks, or as he calls them in the fourth section, ""Card Experiments"". Best of all, this book isn't like most others where the authors seem to purposely be vague (S.W. Erdnase) and not give the best descriptions. Mr. Buckley gives you every detail and is your friend throughout the book, showing you exactly how everything is done without any confusion.
And there is SO much different good stuff in here, that you'll probably never need another book for advanced materials.
It is a great book and a great reference to help you on your way to card excellence and showmanship. You will not be disappointed with this purchase.",Buckley was a card mommer,1019952000,,{'Format:': ' Paperback'}
5,14,False,"08 3, 2001",APTEPFKL03QA0,0486277577,Christian A. Fisanick,"If you've mastered Hugard and Braue's stuff, if you can do 60 classic passes per minute, if you have all the time in the world to devote to card sleight of hand, then this is the book for you!  Seriously, this is a truly excellent book.  Buckley's sleights, though not for the faint of heart, are superb.  (He must've been one heckuva cardician!) This is a serious, serious card magic book.  But if you are serious yourself, you'll get it.  Of course, you'll overlook the antiquated prose and Buckley's tremendous ego throughout.  (When you read this material you'll forgive Buckley's self-congratulatory tone.) This is a splendid work for those who want to be the best...","Very advanced, but as good as it gets",996796800,,{'Format:': ' Paperback'}
5,21,False,"10 15, 2000",A14FXEKB1PXTZG,0486277577,Jose Berlin,"I've yet to see a bad review for this book, and there's a reason. This book is terrific. There is however one issue to be addressed. This book is hard!!! Definitely not for beginners, it has some of what I believe are the greatest but hardest card manipulations out there. I definitely recommend it however to the serious card magic enthusiast. There are enough valuable ideas in here to last you a lifetime.",You better know what you're getting into,971568000,,{'Format:': ' Paperback'}
1,2,False,"09 21, 2007",A1X9QQFMPGDW70,0486402029,Justabuyer,"I don't know how well they work, if they're a miracle, they're too expensive for the quantity.  When I opened it, I thought they'd forgotten to send the tatoos.
10 for 3.50 makes this the ultimate ""skimpy product"".",Don't bother,1190332800,,{'Format:': ' Paperback'}
1,2,False,"01 16, 2007",A1NTAPB1XPB6KK,0486402029,Mandible,"These are cute tatoos for those who love pirates, however, the retail price is $1.50 and Amazon's price is MORE THAN DOUBLE.  I have never paid OVER the retail price for an item at Amazon.  I was shocked.  There are only a handful of tatoos, and for 1.50 I wouldn't mind, but to charge 3.50 for an item that sells anywhere else for 1.50 is criminal.  Find it at a local drugstore and save your $.",The worst value I've ever seen,1168905600,,{'Format:': ' Paperback'}
2,2,True,"01 12, 2007",A34S86H4OJGGVR,0486402029,An Aerospace Engineer,"While my 3 year old son liked th tattos you'd think that a few more could be supplied.  I think there were something akin to 8-10 total.  A few more skull and cross bone flags would be nice.

The tattoos did seem to transfer well but didn't last longer or less than most other temporary tattoos.",Not enough product,1168560000,,{'Format:': ' Paperback'}
4,4,False,"01 10, 2007",A2SGKF4BT5NWYO,0486402029,Mauricio De Maria Campos,"There are only few tatoos so in one week they are gone, it could be better if there were more so they can share with brothers or friends. the alternative is to buy like 4 or 5 of these so the kid doesn't get upset when they are gone to quick. Also with one bath they are gone, so they don't last enough like other tatoos (2 TO 5 DAYS).",Good product but...,1168387200,,{'Format:': ' Paperback'}
5,2,True,"11 3, 2006",AVPT4Q2E2PK9O,0486402029,Derrick,"I'd buy again as a gift for a young kid obsessed with pirates.  However, I never actually had any hands-on time with the tattoos.  The tattoos reminded me of my favorite Cracker Jack prize.",Temporary Tattoos were good gift.,1162512000,,{'Format:': ' Paperback'}
5,7,False,"09 20, 2005",A17AF3GZQEKMYC,0486402029,J. Mag,My young son was thrilled to have tattoos just like a real pirate.  These are easy to use and remove.  I great find!,Huge Hit,1127174400,,{'Format:': ' Paperback'}
5,,True,"01 13, 2015",A2GH1A5JGI8PUN,0486427706,Tara,"Gorgeous, I love the book and the pictures are beautiful!",Gorgeous pictures!,1421107200,,{'Format:': ' Paperback'}
5,,True,"08 21, 2014",AOJTIHPYWGGHQ,0486427706,Kindalyn Phelps,Beautiful art work,Five Stars,1408579200,,{'Format:': ' Paperback'}
5,2,True,"08 14, 2014",A38U7ERUZCBOJ5,0486427706,Joanne Philip Battiston,These are intricate designs for older children and adults. This book is full of beautiful designs just waiting to be awakened by your choice of colors. Great for creativity.,Wonderful designs.,1407974400,,{'Format:': ' Paperback'}
5,4,True,"08 7, 2014",A12VWMI909LC3Y,0486427706,sharon wheeler,"This coloring book was so much fun to color.  I love the fact that you can color both sides & blend the colors!!!!  I would recommend this book for anyone that loves Wizards & Dragons & loves to color with fantastic results!!!!!!!!!!
Sharon","WOW, GREAT COLORING BOOK!!!!!!",1407369600,,{'Format:': ' Paperback'}
5,3,True,"10 6, 2013",A2LSCFZM2FBZK7,0486427706,Ginger,The stained glass pages are pretty cool. And it is nice how the black outlines are super dark and thick. And that the dragons aren't all fighting with the wizards.,Nice book,1381017600,,{'Format:': ' Paperback'}
5,9,True,"08 9, 2013",A3IXP5VS847GE5,0486427706,Dragonflies &amp; Autumn Leaves,"My 11 y.o. loved this...and so do I (you know I really bought this because I wanted to see the pictures myself...I'm just lucky enough to have someone I could justify buying it as a present for.)
Dragons and Wizards...says it all!  With the wonderful see-through vellum like pages, that make it ""stained glass.""  Color it with marker, or anything else really (colored pencil, watercolors maybe), and the light shining through the page makes it look luminous and gorgeous!

Even the perfectionist that gets intimidated with art and drawing tends to find these stained glass books easy to get results they are happy with, so it tends to be an enjoyable and confidence building experience. :)",Great pictures,1376006400,,{'Format:': ' Paperback'}
5,,False,"12 25, 2012",A22WPJ8XFBR00Z,0486427706,Douglas B. McFarling,Awesome! My 8 year old's favorite Xmas gift! It's 9:15 am xmas morning and he's already colored three of these!!,Perfect!,1356393600,,{'Format:': ' Paperback'}
5,5,True,"08 18, 2010",AYLMHOQOT0S4N,0486427706,C. Murphy,"This book has wonderful pictures in it, from dragons to wizards. It is much more than just a coloring book. Very pleased and do recommend it for all ages.",Well done....,1282089600,,{'Format:': ' Paperback'}
5,10,False,"09 16, 2008",AJ8YOQ9V6WTQM,0486427706,Kimberely J. Hardy,I loved this book. the pictures are suitable to hang in windows or glass doors and the pictures really reflect the light. I recomend this for all ages who love art.,My relaxation,1221523200,,{'Format:': ' Paperback'}
5,5,True,"02 6, 2007",A1GGAQIGLJ9PJ0,0486427706,A. Freeman,I bought this for my son who loves to draw.  The pictures are simply beautiful and it is a unique way to produce a coloring book.,Beautiful coloring book,1170720000,,{'Format:': ' Paperback'}
5,,True,"04 5, 2016",A1274GG1EB2JLJ,0486427706,barbara ann,"The pictures are great , I've done one and gave it to a friend of mine who likes dragons.","The pictures are great, I've done one and gave it to a ...",1459814400,,{'Format:': ' Paperback'}
5,,True,"03 20, 2016",AY0ZTKGL6YRVP,0486427706,Samantha A.,"Great buy! Can't wait to work on this book. The dragon images are lovely.  Once I'm done coloring, I will frame and hang in a window to let the sun shines through.",Great buy! Can't wait to work on this book,1458432000,,{'Format:': ' Paperback'}
5,3,True,"03 4, 2016",A2UJW1N1C1EWZ1,0486427706,Cassiopeia,"Holy cow! Ok, so we use Sharpies to color, and this book is AMAZING! We color one side, and the colors transform on the other side. It's so cool, even my husband colors! The designs are great (and I'm a snob) and the price is VERY good for such a cool product.",Stained Glass Perfection!,1457049600,,{'Format:': ' Paperback'}
4,,True,"02 18, 2016",A3BUUV7JLOVSF9,0486427706,SF,I gave this as a Christmas present and it seems it went over quite well.,Four Stars,1455753600,,{'Format:': ' Paperback'}
5,3,True,"02 13, 2016",A30X5EGBYAZQQK,0486427706,Samantha,I absolutely love this book! Its translucent paper make it super fun to use. I have been using Paint Brush Markers and Sakura Gel Pens on it with excellent quality. The only thing that I would recommend is a blank white sheet of paper to make the lines easier to see.,So beautiful!,1455321600,,{'Format:': ' Paperback'}
5,,True,"02 2, 2016",A3N2A0YZYWZJ55,0486427706,Phil Pickett,"Wow, great images on vellum, got this for my husband. He used a combination of colored pencil and marker for pictures, they are beautiful.",Great pictures,1454371200,,{'Format:': ' Paperback'}
5,,True,"01 4, 2016",A1FI4XG4R6BCB4,0486427706,MRMoore,Very nice book. Just wished there was more pages. Can't wait too start using it.,Very Nice!,1451865600,,{'Format:': ' Paperback'}
5,,True,"12 10, 2015",A3U6UNXLAUY6ZV,0486427706,CP in Texas,I love it!,Five Stars,1449705600,,{'Format:': ' Paperback'}
5,,True,"11 9, 2015",A11Z603ZIPLVWN,0486427706,Amazon Customer,Absolutely great pictures even before coloring!,Five Stars,1447027200,,{'Format:': ' Paperback'}
5,,True,"11 7, 2015",AO4V4WNNOIO1,0486427706,Menolly,Great purchase and got it in good time.,Five Stars,1446854400,,{'Format:': ' Paperback'}
5,,True,"10 26, 2015",A1SAJF5SNM6WJS,0486427706,LOIS LABIER,MY HUSBAND LOVED IT. HE IS IN TO DRAGONS.,Five Stars,1445817600,,{'Format:': ' Paperback'}
5,,True,"10 17, 2015",A6K7LYRKJDBSC,0486427706,swiftysue,The dragons are really interesting and fun to color.,Five Stars,1445040000,,{'Format:': ' Paperback'}
5,,True,"10 12, 2015",A2HK5AVQW6AUQ5,0486427706,scootergirl1952,love it,Five Stars,1444608000,,{'Format:': ' Paperback'}
4,,True,"09 15, 2015",AHJWO3SI0S0OR,0486427706,Saundra Hatley,cool,Four Stars,1442275200,,{'Format:': ' Paperback'}
3,,True,"09 7, 2015",A3UMI9SLWY2MKA,0486427706,mary frasier,It's fun.,Three Stars,1441584000,,{'Format:': ' Paperback'}
5,77,True,"07 29, 2015",A1LNKKDBF2KOK3,0486427706,M. Downey,"<div id=""video-block-R3BD06E4PUN30"" class=""a-section a-spacing-small a-spacing-top-mini video-block""></div><input type=""hidden"" name="""" value=""https://images-na.ssl-images-amazon.com/images/I/B141O4IiwKS.mp4"" class=""video-url""><input type=""hidden"" name="""" value=""https://images-na.ssl-images-amazon.com/images/I/810gEm9-iYS.png"" class=""video-slate-img-url"">So many times I've purchased something based on liking a sample (books, albums, whatever) then it turns out that the best thing about the item was the sample.  That is not the case with this Wizards and Dragons stained glass coloring book.

I hesitated to buy this coloring book for fear I wouldn't like the majority of the images, but to my pleasant surprise, every page contains an image I like.  So, I'm posted this quick video review for anyone else like myself, who might be considering this item, but is hesitating due to not knowing what all the images are.  Hope this helps someone.",I Like Every Image Contained In This Stained Glass Coloring Book,1438128000,,{'Format:': ' Paperback'}
5,,True,"07 13, 2015",A2Y9ADG1ST9LWT,0486427706,Amazon Customer,It was so cool the way the pages are transparent so that the coloring shows through and can be hung in a window as a stained glass picture.,Creative stained glass pictures,1436745600,,{'Format:': ' Paperback'}
5,,True,"05 24, 2015",ALLSNTNR6N6UL,0486427706,Amazon Customer,"Exactly as described, nice pictures, great transaction, thank you!","nice pictures, great transaction",1432425600,,{'Format:': ' Paperback'}
3,,True,"04 19, 2015",A3UQFJSEAPSO0G,0486427706,Richard D. Chapman,"5 stars for the delivery. Got it in 2 days after I ordered it. Wow!! As for the coloring book itself, the pages are perforated and you can see through them and your crayons/ pencils show through to the other side. Putting cardboard or a thick piece of paper in between the pages will avoid that. Drawings are nice and you can put them in your windows when done. Thus the perforated pages and thin paper.",Drawings are nice and you can put them in your windows when ...,1429401600,,{'Format:': ' Paperback'}
5,,True,"02 18, 2015",A1MWAQOCENQQ5K,0486427706,Robert Cole,Great!,Five Stars,1424217600,,{'Format:': ' Paperback'}
5,10,True,"04 20, 2011",A18MVTKTTE8OS8,0486448789,JudiAU,"Sometimes you need something new and special that gives you 30 minutes of piece. I used these waiting at the dentist or a graduation or something. They are small so they slip into a bag and cheap enough, especially with the 3 for 4 price on amazon.com . The robots and funny faces are a lot of fun. Probably best at 3-4-5 rather than 2 because the stickers are small.

I love all of the great not-licensed-character stuff by Dover.",Great 30 minute toy,1303257600,,{'Format:': ' Paperback'}
5,,False,"04 2, 2011",A2C2TLRMMMLAJV,0486448789,D. Workman,"These little books are great! They are small, but perfect for birthday party favors, which is what we used them for! There is a blank page after each page of stickers, so that's where my kids made their robots. They were a huge hit!",great!,1301702400,,{'Format:': ' Paperback'}
2,4,True,"02 7, 2011",APTGPJM3QRMHT,0486448789,thunification,"This is indeed a small book. This particular ROBOT sticker book was at best, OK.
Why? Well, there's really no space to create multiple robots. Stickers are not easy to remove.
Not recommended unless you just gotta have it to entertain a child. But this may only last ten minutes.
Plus side, small enough to stick in purse for travel.",Only OK ...AT Best,1297036800,,{'Format:': ' Paperback'}
