overall,vote,verified,reviewTime,reviewerID,asin,reviewerName,reviewText,summary,unixReviewTime,image,style
4,,True,"12 25, 2013",A2RCHDZ4J7Q6Z4,0545561647,@theglitzygypsy,"I bought this for my 10 year old son and while he really liked it, he did not have the patience for all the fluffing you have to do to make some of the puppies. We did have fun doing it together tho...I was clearly in charge of the fluffing as we made the Pomeranian. I felt the amount of yarn that came with it was skimpy, however, and we had to cut our yarn slightly shorter than the instructions called for because there was not quite enough.",Cute Little Puppies!,1387929600,,{'Format:': ' Product Bundle'}
4,13,True,"12 20, 2013",A1UKX6QG02W1WD,0545561647,Friday98,"I bought this for my daughter and I to do together. She is five and a little young for some parts but we have had a great time making cute puppies. My only suggestion would be to buy a lot of extra super glue because the one that comes with it doesn't hold and you'll probably need extra yarn. One of my kits was missing eyes, noses and tongues but after a call to the manufacturer they sent me two entire replacements so I can't complain about that.",Great craft activity,1387497600,,{'Format:': ' Product Bundle'}
5,65,False,"11 19, 2013",A2J1JSQTE7TH9F,0545561647,silkybee,"This kit is AWESOME! My 5-year old daughter and I made the chihuahua dog first, and it came out looking exactly like the picture. Although I love crafts I'm not that great at them, so I was delighted with this result. This is the first project I have ever done where the finished product looked as good as the picture - and on the first try!

The book gives really straight-forward, easy-to-follow instructions. They show you how to make dogs that look like the real breed! We have made 6 dogs now, from the easiest to the most complicated in the book, and they're all great.

My daughter wraps the pom pom and cuts the pom pom. I do the tying. She cuts out the ear shapes, and decides which decorations to use. For a 5-year old, she can be quite involved, but she definitely needs my help. It's a really fun project to do together.

One thing: the glue in the kit is actually pretty good, but you'll still have to hold pieces on and wait for things to dry. We have a little hot glue gun, and this has made the process easier and probably helps keep the dogs holding together better. My daughter is playing with the ones we made and sleeping with them and they hold up like regular stuffed animals!

We made 4 dogs with the kit supplies, then promptly went to the craft store to buy more supplies to make more pups! We bought a bunch of different thick yarn types and they all worked well and gave different effects! Once you get the hang of it you can get creative too. You could easily make cats, rabbits, a turkey - whatever you want that you can imagine doing with pom pom shapes.

Pros:
Great, easy directions
Nice supplies in the kit
Variety - you can make so many types of dogs!
Fun project to do with your kids
The finished product is super cute and kids will love them like real stuffed animals
Kids could make these as gifts for their friends, or even ornaments for relatives
Lots of room for creativity
You can keep making dogs forever by buying supplies at the craft store
Price - you get to make 4 dogs, which equals out to less than what you'd pay if you bought a similar pre-made dog at the store
Amazon price- I bought this in a store and paid 20 bucks so the price here is great
This kit would make an awesome present for any young girl!

Cons:
The glue: this kit is a lot more fun if you invest in a hot glue gun
More money :) if you love this kit as much as we do, you'll end up spending a lot more in the craft store to keep going with it!

I hope you have as much fun with this project as we have!",Easy! Finished product as cute as the cover!,1384819200,,{'Format:': ' Product Bundle'}
1,2,True,"11 15, 2013",A6GT57LLC038X,0545561647,BugandBoo,This is horrible! The directions are very hard for a child to read and comprehend themselves. The yarn made a mess. My daughter was so excited to get this and cried when she couldn't understand how to make them. I would not recommend this to anyone!,Not worth the money!,1384473600,,{'Format:': ' Product Bundle'}
4,9,True,"11 9, 2013",A11KL4GOTFBEBR,0545561647,Teach-abc,"This was a gift for my niece, because she loves dogs.  There are a lot of great ideas.  I am going to add a few more supplies so that she can continue to add more.","Love the ideas, but a few more supplies would be nice.",1383955200,,{'Format:': ' Product Bundle'}
5,71,True,"07 8, 2013",AHUMS2PZ6NTI3,0615638996,adam_d_j,"I'm a mental health therapist that works with kids, many of whom have anger control issues. All kids love playing Uno and this is essentially Uno with anger control tips to learn along the way. Although I felt that 20.00 was a little expensive for a card game, it's gotten more than its fair share of use. It's great to start conversation with kids who just want to play a game and aren't super interested in talking. I even had one of my clients ask his mom to buy the game so they could play at home. My one complaint is that the cards are very big! It's hard for a lot of my kids to actually hold the cards since they're like supersized playing cards.",Great therapy game,1373241600,,
5,2,True,"06 30, 2013",A3BWPV37V9712L,0615638996,simmonslmft,"These are great for clients who struggle with how to control their anger.  It is actually very similar to another card game, UNO.  However, it has definite therapeutic value, as half of the cards have questions, suggestions, and activities to cope with anger.",Great,1372550400,,
2,20,True,"06 15, 2013",A2QKXDYCFHXMT6,0615638996,GloryDays,"I found that this card game does the opposite of what it was intended for. It actually has the kids focusing on ways to get angry, etc. instead of teaching how to be calm and act better. It really should have been tested before sale. A better game would have been Calm Dragon. I tried this game on kids that had absolutely no behavior or anger problems and they began behaving badly and getting angry after the second round. I don't recommend this. I am a therapist and I work with kids with anger issues all day long, I thought this might be a good tool... I was wrong.",Promotes anger instead of teaching calming methods,1371254400,,
4,2,True,"06 3, 2013",A1MYFQM0E0CJ7,0615638996,Ann M. Suabedissen,"One of my staff will be using this game soon, so I don't know how well it works as yet, but after looking at the cards, I believe it will be helpful in getting a conversation started regarding anger and what to do to control it.",Anger Control game,1370217600,,
5,6,False,"04 24, 2013",A2FUTLGFOAOA4T,0615638996,Donna,"In the mental health field,.this is a great item to use to teach anger management and kids of all ages loves it",great game,1366761600,,
5,18,True,"02 26, 2013",A2RPNZU9UME5IH,0615638996,Laura M. Robold,Really good for working with children with anger issues and a fun game that children will enjoy playing with an adult.,Great for children,1361836800,,
5,62,True,"11 14, 2012",A3AAZ1ENAPB012,0615638996,Jennifer Brown,"This is a great game for talking about anger and having fun at the same time. My son, who is 5, gets angry very easily and usually does not want to talk about it. When playing this game, he was more than willing to talk about his anger and ways to help control it. He loves playing this game! There was actually improvement in his self control after the first day that we played it. I was pleasantly surprised. Much recommended!",Great game!,1352851200,,
5,28,False,"09 21, 2012",A2HRTNSNA6MTFN,0615638996,Cowboy Bob,"This game is really simple yet surprisingly effective in helping kids learn basic anger control strategies. I use it with 8- and 9-year-olds, and they do seem to retain and use the anger control techniques it teaches. It's an inexpensive way to help kids manage their impulses and get at least some control over their emotions.",Fun and Effective,1348185600,,
5,,True,"12 18, 2017",A37EJZYNWEFFXS,0615638996,melissa butler,"This game is basically UNO, but with fun ""how to control emotions"" suggestions on about half of the cards. It's a great way to have fun and relax with your kiddo and occasionally bring up anger-management ideas in a non-stressful way.","but with fun ""how to control emotions"" suggestions on about half of ...",1513555200,,
5,,False,"12 14, 2017",A3A8NJOKB0U6KT,0615638996,Donny J Nolasco,Im a behavioral health counselor at an intermediate school and play this game with my students. The kids love this game because it is played like Uno. There are plenty of opportunities to answer simple yet meaningful questions that help kids with anger.,The kids love this game because it is played like Uno,1513209600,,
5,,True,"11 27, 2017",A2J8AAYKIN221A,0615638996,Amazon Customer,Great!,Five Stars,1511740800,,
5,,True,"11 27, 2017",AB4XVE8M861N6,0615638996,Amazon Customer,Great game for anger awareness and discussing coping strategies in a fun way.,helpful tool and fun to boot!,1511740800,,
5,,True,"11 25, 2017",A72CA507WPKTN,0615638996,victoria golden,The kids love this game. They already know how to play and enjoy answering the questions.,Excellent Therapy Game,1511568000,,
5,,True,"11 23, 2017",AF9NFASDBPD4T,0615638996,theresa mitchell,As a therapist who plays a lot of UNO with children who have anger impulses this is a good way to teach new coping skills that children like.,Good quality.  Use frequently in plat therapy.,1511395200,,
4,,True,"11 22, 2017",A1O2IVHYVHSXGJ,0615638996,melinda,Similar to Uno!,Four Stars,1511308800,,
5,,True,"11 16, 2017",A3MW6W611E4P6X,0615638996,Blender User,"I'm a therapist that works with children.  I play this game with my 6 - 15 year olds.  It plays like Uno, so the kids are familiar with the concept.  It has enough stops in it to discuss anger issues without slowing down the game or frustrating the kids.  I recommend this game to those in my profession.",Good therapy game!,1510790400,,
5,,True,"11 15, 2017",A3NCUFF540KY1E,0615638996,AndreaD,Great game in therapy when working with children.,Five Stars,1510704000,,
5,,True,"10 31, 2017",A1536X1HGNZQR5,0615638996,CB,"This is a great resource for kids to help with their anger.  I'm a therapist and use it with my adolescent clients.  The kids love that it's a game, similar to Uno, and I love it because it's teaching them skills.",Great game,1509408000,,
5,,True,"10 30, 2017",A3BRYA0QO9NRH2,0615638996,Geraldine Bennett,"different, kids had red faces, not sure they like",Five Stars,1509321600,,
4,,True,"10 26, 2017",A3HK2WXRGZBZNU,0615638996,gatrell,nice cards,Four Stars,1508976000,,
5,,True,"10 22, 2017",A2W3VXRAALJOZQ,0615638996,Lili,Clients enjoy it!  The card questions have brought up good discussions and insight.,Clients enjoy it! The card questions have brought up good ...,1508630400,,
5,,True,"10 20, 2017",A1VAXH9XGSH3J2,0615638996,AnnieShoakley,Wonderful tool for use when working with children with anger management symptoms/diagnoses.,Five Stars,1508457600,,
5,,True,"10 10, 2017",A1EJB4P2L8CUVV,0615638996,Edgar,"Used in sessions. Just like playing UNO (which most children know how to play already), so the child jumps right into the game. The fact that not every card has a prompt on it makes it feel like a card game with questions; as oppose to a psychoeducation lesson with cards. I use about 3/4 of the deck (there are a lot of cards) which means that you will not go through all the prompts in one session. Highly recommended.",Made Anger management session fun,1507593600,,
5,4,True,"10 4, 2017",A3KBC56PHO0GK1,0615638996,S. Dube,"So I work as a mental health clinician in a locked facility with adolescents who have some anger issues due to experiencing ALOT of trauma. They also have to deal with really really stupid rules, which triggers both them and myself. I'd say they are at ages 6-12, when it comes to controlling anger. With that said, this game was a lot of fun during session and in anger reduction group. It's just like UNO with some anger control techniques and talking points thrown in! I love it and am extremely happy I bought this. It is so much fun and helps my adolescents talk about their anger and reframe that anger in a positive way!",Locked Facility,1507075200,,
5,,True,"10 4, 2017",A11XMU9TAHZOAR,0615638996,Lesley,Great game to play for children and any other people that has anger issues.,Five Stars,1507075200,,
5,,True,"09 28, 2017",A2GRDH2TMLS6XM,0615638996,John Stebelton,The game was received really well by my kids. The adult facilitation helped a lot.,Kids loved it,1506556800,,
4,,True,"09 27, 2017",A14MLXIP3M359P,0615638996,Anonymous,"Great for the younger children, but when they begin adolescence, they make fun of this game.",Four Stars,1506470400,,
5,,True,"09 20, 2017",A34K6JFWNWJU3I,0615638996,me13,I have played this game with quite a few clients already and so far it is going well. The cards are made well too which is important for someone who will need to get a lot of use out of them.,Decent game for therapy,1505865600,,
5,,True,"09 3, 2017",AQOPQ5BXAIHC7,0615638996,C. Carney,"I use this game with children and families. It is very helpful for helping people to open up about feelings, especially anger. So far have used this with ages 5 and up, with great results.",with great results.,1504396800,,
5,,True,"08 29, 2017",A28GQSLO3S3LPB,0615638996,traci s,I used this game a lot when I was doing in home therapy w/ kids. It's a great nonthreatening way to introduce topics and touch on some skills.,It's a great nonthreatening way to introduce topics and touch on some ...,1503964800,,
5,,True,"08 25, 2017",A33ZCP8L9OTINA,0615638996,AM,"I'm a child therapist, and I love this game. Engaging, fun, and simple to play.",and I love this game,1503619200,,
5,,True,"08 21, 2017",A3CQ6F7ZQ4LE9A,0615638996,Amber,"I work as a school psychologist, and my kids in counseling love this game! Such a great tool that combines social-emotional learning and fun.",Combines social-emotional learning and fun,1503273600,,
5,,False,"08 14, 2017",A1WBRDKV1S9IKK,0615638996,MBMB,Great tool #SchoolPsychologist,Five Stars,1502668800,,
4,,True,"08 13, 2017",A3PYSRUXHLZBUD,0615638996,noky64,"A little expensive, but a helpful therapy tool for working with the younger kids.  It plays just like Uno and has questions on half the cards, which is more than enough.  I'm satisfied with this purchase.",helpful therapy tool for younger kids,1502582400,,
3,2,True,"08 11, 2017",ALIQDPUIOH8AY,0615638996,Maria F,"Great questions. Cards are kind of large to be using with children. There are almost too many questions to play one on one, which is how I use it and had intended.  It would be better in a group setting for the number of questions.","Good, but think of you age group",1502409600,,
4,,True,"08 3, 2017",A2MHBX3JSYLZ1C,0615638996,Negadelphia,It's ok. But loses it's luster quickly.,Worth a try.,1501718400,,
5,,True,"07 26, 2017",A16337ABLW0RXW,0615638996,Deborah Turner,I love this game for my therapy sessions. Clients love it too. It's a great way to teach anger management skills in a fun way.,Fun therapy tool,1501027200,,
5,,True,"07 18, 2017",A3EUANVTIDSXXF,0615638996,somegirl85,This is one of my top go to games during my social work sessions with kids.,Five Stars,1500336000,,
4,,True,"07 18, 2017",A5I2NO162JT78,0615638996,DIYGUY,Great therapy gap for kids! Some questions can be a little complicated depending on the age of the child but overall great therapy tool!,Great therapy gap for kids,1500336000,,
5,,True,"07 4, 2017",A1TBXKKJDBUWG6,0615638996,AndreaMcG,It's really helping my ADD'R learn to discuss his anger constructively,Five Stars,1499126400,,
5,,False,"07 3, 2017",A2YMEG2CM4D5FN,0615638996,Michelle,"I am a social worker on an inpatient psychiatric unit for children and adolescents. This game is easy for all ages to play, and while some of the scenarios/questions are a little simplistic, it gives the kiddos a safe way to express different ways to handle anger. When playing with mixed ages or ability levels, I have found that the younger kids often push the older kids to think harder about their answers and give options to them for responses. I love using it in my groups, and almost everyone can use a little help with anger management!",Great tool for social work groups!,1499040000,,
5,,True,"07 2, 2017",A126ESHD49ZS8Z,0615638996,Amazon Customer,My kiddos always ask to play this. Makes for great group therapy sessions or even individual if you need to talk more in depth with a kiddo. I would high recommend this game to therapists.,Fantastic!,1498953600,,
5,,True,"06 29, 2017",A1LXKVUQS4HYU0,0615638996,Amazon Customer,"My son has ADHD and has trouble regulating his temper. This game is very simple and would not be as fun for me to play if it did not have these positive messages and question stems. I encourage any parent with a child with ADHD to purchase this product. The statements can be repetitive enough for your child to begin to understand how controlling his or her anger is beneficial. He really enjoys this game. It can be a relatively quick game with five cards per player. Every time we play, I remind my son of the positive messages on the cards. He loves it!",This game is very simple and would not be as fun for me to play if it did not have ...,1498694400,,
5,,True,"06 26, 2017",A2O0LHS4AH5UP2,0615638996,Amazon Customer,Good~,Five Stars,1498435200,,
5,,True,"06 12, 2017",A3VXFJR63XJ75S,0615638996,Amazon Customer,"I am a therapist who specializes in working with children and I use this game with kids all the time, it is fun while also helping us access important emotional themes.",it is fun while also helping us access important emotional themes,1497225600,,
1,,True,"05 15, 2017",A3DEG6M8HWC7M3,0615638996,Munchkin&#039;s Mama,This game is extremely boring and takes far too long.,One Star,1494806400,,
5,,True,"04 25, 2017",A30WFATF1FEBCV,0615638996,Connie Richardson,this is a fantastic game great questions. Kids do need to be able to read to make it go smoother,Great game,1493078400,,
5,,True,"04 22, 2017",A2I4H5PXCG35DB,0615638996,Dragonfly,great,Five Stars,1492819200,,
4,5,True,"04 13, 2017",A2M4N65WLRY2BZ,0615638996,Becky Norum,"I've played this with my eight-year old and six-year old twins.  They all enjoy the ""Uno-like"" game aspect and also we have fun talking through the different questions that pop up.  I do find the questions become a bit repetitive after a few games, so I think this is more of a game to pull out once every few months rather than every night.  One way specifically it helped us is that it gave me (mom) the opportunity to share more, which helped the kids open up about situations and feelings.",Recommend as occasional game,1492041600,,
5,2,True,"04 12, 2017",A2VQBM7C92KPA5,0615638996,Sandi,"I use this with my elementary students in counseling.  It is enough like Uno that the kids catch on quickly, but also get the benefit of therapeutic interventions.",A good game for individual or group therapy.,1491955200,,
5,2,True,"04 3, 2017",A2CO7OWFOMNG7M,0615638996,bashful1269,"I really like this game, it helps kids recognize anger and talk about difficult emotions.",Great game for therapy,1491177600,,
5,15,True,"03 23, 2017",A3CBCCYRK31GVT,0615638996,TN,"The game is basically Uno with discussion cues on some of the cards. It can take a long time for someone to win the game too...

Our daughter has been having anxiety and getting angry easily lately. We noticed she's been going to the red zone of anger so quickly that there isn't time to calm down and talk through what's been upsetting her. Even after she calmed down she didn't want to talk about it. The day Mad Dragon arrived, we all sat down and played it before bed. She started opening up about all the things that have been bothering her and we get to tell her about similar instances when we were growing up. We love that it also reminds her about ways to keep calm and why it's better than getting angry. Once in a while she'll tell us how she didn't get mad at school like the Mad Dragon! She asks to play it every night- so she clearly enjoys the game.",5 year old finally opened up!,1490227200,,
5,,True,"03 21, 2017",A2GHL3FY2NT8Q7,0615638996,Beth Kanne,Good game--like Uno but with meaningful (therapy) content.,Five Stars,1490054400,,
5,,True,"03 19, 2017",A2N1OS1SNS9LF,0615638996,islandgirl,I like how this game helps build emotional management/conflict resolution skills while adding a play aspect. My students seem to enjoy it.,I like how this game helps build emotional management/conflict resolution skills ...,1489881600,,
4,,True,"03 14, 2017",AY3S42TBRAMUK,0615638996,quilterldy,"Good game for helping kids deal with anger.  I'm using both one on one and in group therapy.  I think the price is high for a card game, but the game itself is a helpful tool to teach anger management.",Good game for helping kids deal with anger,1489449600,,
5,,True,"03 13, 2017",APPEUNQO889AZ,0615638996,K.M.F.N.,love it,Five Stars,1489363200,,
5,,True,"03 12, 2017",A19Z0CP64QK444,0615638996,Amazon Customer,Fun for the whole family...Very fun to watch adults try to answer the questions as the children watch.  Caused me to examine the behavior I model for my child...GREAT GAME!,Fun for the whole family,1489276800,,
5,,True,"03 11, 2017",A32H46G6R68M31,0615638996,Shopaholic@night,Great resource for BHIS care coordinators!! Works well with kids and teens on what it says it does!!,Perfect!,1489190400,,
5,,True,"03 5, 2017",A35UZ18AM5JEYI,0615638996,C. S. Parr,kids LOVE this !,Five Stars,1488672000,,
5,2,True,"03 3, 2017",A2RJL2FUHNAWMM,0615638996,Bekkah K,"If you know how to play Uno, then you basically know how to play this game. On some of the cards, there are questions that help children recognize body sensations when they are angry, problem solve what they can do if something starts to upset them and gives them tools to use. 100 cards in the deck. My six year old wants to play this every single night and this game is helping him with emotional regulation. My 8 year old likes the game too, but doesn't always want to answer the questions (depending on how his day has gone). If you are looking for a fun way to help teach the children in your life tools for emotional regulation, I highly recommend this game!",If you are looking for a fun way to help teach the children in your life ...,1488499200,,
5,,True,"02 18, 2017",A1QV99K8VVAU32,0615638996,CowMoo,Using in one-on-one or family therapy sessions. The kids love it. Just like Uno.,The kids love it. Just like Uno,1487376000,,
4,,True,"02 12, 2017",A1T12HO4P5SDNR,0615638996,Krystie,Good game for helping kids learn to control emotions.,Four Stars,1486857600,,
5,,True,"02 11, 2017",A1PY7EGMQ1TS9E,0615638996,"Rivka Edery, M.S.W., L.C.S.W.","Great, fun game as an ice-breaker or group activity!

-Rivka Edery, M.S.W., L.C.S.W.
Author of:  ""Hear Me Sing: Book I"" (2016)
Trauma and Transformation: A 12-Step Guide (2013)","A fun, interactive game to teach kids about anger-management!",1486771200,,
4,,True,"02 4, 2017",AQ746Y02X4JER,0615638996,Bettina Neuefeind,This has been a fun game with 3 kids.,"Fun, like Uno with some talking points thrown in",1486166400,,
2,,True,"01 29, 2017",A33A5LND5C8JAI,0615638996,Martha Ledonne,"This is basically Uno.  I don't see how they could be useful as therapy tools.  Cute deck, though - we will use them.",I don't see how they could be useful as therapy tools,1485648000,,
4,,True,"01 29, 2017",A1O7SMSMZDB124,0615638996,Sarah V,"It's Uno with questions about anger. It's an okay way to discuss anger, but it gets repetitive and the students start to get bored after about half a round.",but it gets repetitive and the students start to get bored after about half a round,1485648000,,
4,,True,"01 14, 2017",A2WN5XO5N3JL6O,0615638996,Sue M,Kids I work with like this game.,Four Stars,1484352000,,
5,,True,"01 9, 2017",A2N229TSOKP2TD,0615638996,Kristen,Great family game addition for child that struggles with self-control/anger.,Five Stars,1483920000,,
5,,True,"01 4, 2017",A1CH0ZJ8AOORZM,0615638996,none,"Satisfied, thanks",Five Stars,1483488000,,
5,,True,"01 2, 2017",A3TPN09RM8YH6R,0615638996,Theresa,Love it,Five Stars,1483315200,,
5,,True,"12 18, 2016",A3DZG6KKPDWW42,0615638996,EmJay,I'm a mental health clinician who works in schools. This game is played just like uno and my children love the game. I usually have then read the question and we both answer the questions. I usually go first to give the kids an idea of how to answer just in case they are stumped. This game prepares the child to know how to defeat anger and to lets them know that they are essentially in control of their anger.,Perfect game and so simple.,1482019200,,
5,,True,"12 10, 2016",ABZ17HYWULO4Q,0615638996,Amazon Customer,It helped,Five Stars,1481328000,,
5,,True,"11 20, 2016",A2BZPGE2BMQPJ7,0615638996,ML Vandenburg,"This game is great- the students ask to play it over and over.  It gets them talking much more than if I would just ask them the questions and if they are hesitant, I will answer the question honestly and model that it is ok to be honest.",This game is great- the students ask to play it ...,1479600000,,
5,,True,"11 11, 2016",A1TKY3LRB70TKJ,0615638996,Amazon Customer,This game is a hit with everyone whoever created this gold star! Not only is it fun it's also educational.,Get it no matter what,1478822400,,
5,,True,"11 4, 2016",A1D7NGXWRZDCCA,0615638996,Catherine Tietjen,good therapy tool,Five Stars,1478217600,,
