overall,vote,verified,reviewTime,reviewerID,asin,reviewerName,reviewText,summary,unixReviewTime,image,style
4,,True,"12 27, 2011",AHF976BFWTTVG,0486448789,L. S. Littrel,My son is 5 and LOVES robots. He likes to change the parts around to make different robots. There are 4 different types to interchange.,robot lover,1324944000,,{'Format:': ' Paperback'}
5,6,True,"04 24, 2011",A2UNKYXPZRWX5,0486448789,Stroller Snob,Perfect for that long airplane ride for my almost 6 year old son. Small enough to fit into my handbag. The stickers can be re-used over and over again to make new robots. A must for any busy mom!,Entertains A 5 Year Old Boy!,1303603200,,{'Format:': ' Paperback'}
3,,True,"05 10, 2013",A3T8MS4V4EXMOJ,0545325234,Liz W,"My one-year-old got this as a birthday present. Within a week, the head fell off the handle of the hammer (we glued it back in place with rubber cement) and one of the peg holes no longer holds a peg in place. The plastic part that helps hold the peg is broken or has shifted. I don't know how to fix that.",Doesn't hold up well,1368144000,,
3,,True,"04 28, 2013",A2Y2HURKWJWU0D,0545325234,sally butcher,"MY kids grew up with a peg bench and hammer and loved it, but I bought this brand for my grandson and was disappointed. The pegs  fit too loosely into the bench and he does not even use his hammer to pound them in, as he can  just push them in with his hand, or sometimes they fall through automatically.  My suggestion is to make the pegs fit a little tighter so the kids can learn skills of coordination, etc when pounding them in.  The pegs are nice and thick for little hands, but just not snug enough fitting to really use the toy as it is intended,",Disappointed,1367107200,,
1,,False,"01 13, 2013",A1Q72NO1MBXHSV,0545325234,Coloradigirl,This is a poorly put together piece of junk. We try to purchase toys that are simple and built with materials that will last. We loved this toy as kids. Sadly the pegs fall right through and the ends of the block are wobbly so we can't use it. Return shipping was more than it was worth to send it back.,Junk,1358035200,,
3,,True,"01 8, 2013",A2R4PRZK0WTUFD,0545325234,Michelle,"The hammer fell apart right away, but was able to fix with glue.  The hassle free packaging was nice, but didn't appeal as a Christmas present.",OK,1357603200,,
3,4,True,"12 2, 2012",ASDTJOZI8ZJO9,0545325234,Amazon Customer,"I bought this for my son because I remember how much fun I used to have with Pound a Peg! Anyway, we get the toy and my son pulls the pegs out and when I go to put them back in I notice that the pegs are suppose to be held in place by plastic rings set in grooves in the holes. Which aren't fitted. The plastic rings move around in the groove. The wood doesn't actually provide tension like old pound a peg toys. Soo the pegs don't fit right. My son doesn't even get to hammer 3-4 of them because they just fall right through. I was very disappointed. =/",Eh,1354406400,,
4,,True,"09 21, 2014",A1AVB9BG957JH,0545346193,James B.,"My five year old grandson, my wife, and I were able to draw some characters that were recognizable. Without this book...no way.","My five year old grandson, my wife, and ...",1411257600,,{'Format:': ' Paperback'}
5,,True,"03 6, 2014",A177YI1Y3TCA64,0545346193,M. Morgan,The book gives a nice feel and step by step directions. I bought thins for my son with high functioning Autism. He has been using it often.,Great for the comic lover,1394064000,,{'Format:': ' Paperback'}
3,3,True,"02 23, 2014",A3N0AXNEZVE686,0545346193,Kindle Customer,"The packaging for a draw-your-own DC Universe makes it look easy enough, but think twice before purchasing it for your own beginning artist.  It is entirely possible that he/she will be ultimately disappointed (or at least frustrated) that their art won't resemble the professional examples provided considering the minimal directions given.

Four double-sided color pencils (for a total of eight different colors), a black marker (for bolding), speech balloon stencils,  and an eraser are provided.  The problem here is that it really becomes more practice in tracing than actually learning how to draw.  Each exercise is four steps: 1. a stick figure; 2. the pipes 3. details; and 4. ""detailed"" details.  There aren't any transitional instructions on how to actually get from Step 1 to the final image; it is just a visual demonstration.  This book is best for those amateurs with some basic art class experience in terms of knowing how to draw details once they've have made the circles and connecting lines.

Rating: 3/5 stars (No recommended age, as any person's artistic talent will vary, no matter the age.  Instead, a beginning drawing class is best before tackling this book).",Great Idea But Needs More Instructions & Details For Beginning Artists,1393113600,,{'Format:': ' Paperback'}
5,,True,"02 6, 2014",A15ZVKJYE78JI4,0545346193,Jasmine,"My son loves this.  He has drawn the most MIND BLOWING art in this book.  So good.  He is learning so much.  It is really well put together with tracing pages and all sorts of tips.  I highly recommend this, even for adults.",This is FANTASTIC!,1391644800,,{'Format:': ' Paperback'}
4,,False,"01 22, 2014",A33VBX34BJSIAS,0545346193,Emmerson Dwarika,This book takes you from fairly simple to much more advanced drawing techniques. Get it for anyone that is interested in drawing comics that can draw a little already even a child.,Very good book,1390348800,,{'Format:': ' Paperback'}
5,,True,"01 4, 2014",A7FS8IUY3J8MC,0545346193,AMB,"Klutz X D. C. = highly engaging for pre-teen boys. We had one of our own, and a friend loved it so much we had to get him one.",very engaging,1388793600,,{'Format:': ' Paperback'}
2,,True,"12 30, 2013",A2DAI8HUWOXWX0,0545346193,Amazon Customer,The drawing instructions were good but I was disappointed to find no colored pencils in the attached part. Thank goodness I had purchased other drawing utensils.,Picture part was good but there were no pencils,1388361600,,{'Format:': ' Paperback'}
5,,True,"05 30, 2013",A3RBDX2DDBT6IN,0545346193,Quinnell Trujillo,This makes a great gift for anyone who loves Super Heroes and also loves to draw. Top quality pencils too. And the best part....totally affordable.,Beautiful,1369872000,,{'Format:': ' Paperback'}
4,15,True,"11 14, 2012",AXZCAKY84NIGI,0545346193,Desert Toyman,"I'm 37 years old and I just took up drawing again for the first time since high school.  I wasn't that great at it then so I'm not all that advanced of an artist.

This book is the perfect skill level for someone like me.  I mostly can copy things right now, but if I draw something from memory, my lack of skill is apparent. That was my motivation behind buying this book.  I needed to build on my skills and this book looked like the perfect thing to help with that.

The book starts out with having you trace some pictures just to get your hand and eye used to drawing different lines.  I have to say that this may have been one of the most interesting pieces of advice that I have learned from this book so far.  I would have never even considered tracing something in the past, but now I want to go buy some tracing paper and try a little more tracing.

As you move through the lessons they become more difficult.  After tracing, you work on stick figure frames for the characters, next you practice ""piping"" which is where you draw guides for the outside lines, and then finally you move on to the detailing that really makes your drawings come alive.

The book is set up so that you can draw in the book itself.  This is a great idea as well, but this is also where I ran into my issues with the book.

1. It's too small.

At 8.5 x 8.6 inches the book isn't even as big as a standard piece of paper.  It's tough to practice drawing details when you don't have much room to fit those details into.

2. The book doesn't lay flat

The book has a traditional binding so the pages have and arch to them when you try to lay it out flat to draw in it.  You need to press down on the pages to flatten them and even then there is still a little curve to them.  It makes it tough to draw straight lines at times and since I, and the target audience of this book, aren't that great of artists at this point, it really makes it frustrating to do some of the lessons.

If this book had spiral binding, like a notebook, and was larger I would give it 5 stars in a heartbeat.  As it stand now, it's 4 stars for me.  I am still glad I bought it because I really feel like it gave me some good things to practice.",Good for beginners,1352851200,,{'Format:': ' Paperback'}
4,9,True,"09 21, 2011",AHN1X9XWITFYF,0545346193,Carey,"I like the book, just wish it was larger.  It is targeted more for kids, than aspiring artist, but it still has valuable lessons in it.  I would recommend this book to anyone that is interested in learning how to draw the classic look of the DC characters, since they have now been changed in the ridiculous ""new 52"" event.",It's good,1316563200,,{'Format:': ' Paperback'}
5,,True,"10 4, 2015",A2TGSRD2HCL81Y,0545346193,Dylan,"Love it, very helpful",Five Stars,1443916800,,{'Format:': ' Paperback'}
2,,True,"05 17, 2015",A22TO7LO5I04CL,0545346193,Erin Oliver,this wasn't really what I thought it would be...,Two Stars,1431820800,,{'Format:': ' Paperback'}
5,,True,"05 13, 2015",A1EHGC7RM11TQB,0545346193,Demon,I have always been able to draw what i saw with limits now i can create them from my own imagination.,I have always been able to draw what i saw ...,1431475200,,{'Format:': ' Paperback'}
5,,True,"02 19, 2015",A1YJP532CJMQT,0545346193,Ricky Hammond,My 8 year old Son LOVES this Drawing Book.... LOVES IT!!!!!,Awesome Book...,1424304000,,{'Format:': ' Paperback'}
5,,True,"02 11, 2015",A1BG2P9Y8RCIAZ,0545346193,Lisa NG,Our little artist loves this kit.,Five Stars,1423612800,,{'Format:': ' Paperback'}
5,,True,"01 28, 2015",A2T6UJ8K87W4HU,0545346193,JanetD,This was a Christmas present for a nephew who loves to draw and he loves superheroes.  He was very happy with his gift!,He was very happy with his gift,1422403200,,{'Format:': ' Paperback'}
3,2,True,"01 18, 2015",A2NKECPWN20YAQ,0545346193,Denine,"The quality of the book is awesome. I gave it a 3 star review because, This is a book for someone who is more advanced than a beginner. You can trace mostly. It lacks instructions for the comic book drawing beginner.","Not for beginners, however great for the comic book lovers.",1421539200,,{'Format:': ' Paperback'}
5,,True,"01 12, 2015",A9V7MUGGFFT7R,0545346193,Monique K.,Awesome book,Five Stars,1421020800,,{'Format:': ' Paperback'}
5,,True,"01 4, 2015",AR4T6MHMX375H,0545346193,Tater,love this delivered on time,Five Stars,1420329600,,{'Format:': ' Paperback'}
5,,True,"11 29, 2014",A2PU5WLK5270D2,0545346193,J. Martinez,"Awesome. Starts of by showing basic stick figures and then adding more details first. Outstanding book and I would
highly recommend to anyone looking to learn the DC way to draw heroes!!!",Awesome. Starts of by showing basic stick figures and ...,1417219200,,{'Format:': ' Paperback'}
5,2,True,"11 5, 2013",A20IB5KQKH7CCB,0545561647,MissCindypieO,fun stuff for the kid.. kind of messy but.. still lots of fun for them.. my kid is good at crafts so she made three dogs right away..,fun stuff,1383609600,,{'Format:': ' Product Bundle'}
5,55,False,"10 16, 2013",A29MXJTBLR1Y46,0545561647,luvmodern,"My daughter is a huge fan of Klutz books and couldn't wait to get her hands on Pom-Pom Puppies. She made a Chihuahua, a Dalmation and a few mutts and they're getting cuter and cuter. The directions are really good (it can be challenging for an 8 year old to cut the yarn). I highly recommend this as a present to any kid who loves dogs, the results are really cute.",My Daughter Adores this Book,1381881600,"['https://images-na.ssl-images-amazon.com/images/I/81ffFikS0uL._SY88.png', 'https://images-na.ssl-images-amazon.com/images/I/6184eSuqIWL._SY88.png']",{'Format:': ' Product Bundle'}
5,50,True,"10 7, 2013",AZQQI7C36YF1G,0545561647,J. Patton,"My daughter just turned 6 and spotted this at a Scholastic book fair. I bought it for a birthday present, and so far we've made one puppy. It is definitely a collaborative effort at this age, though she can do a lot of the work -- trimming the pom poms, gluing, etc. The directions are clear, the photos are adorable and the materials are of good quality. We will definitely have to get more glue -- I think we've used half a tube on one project -- but I think it's just basic white school glue. So far, it's a big hit -- and fun for grown-ups, too!","So far, so cute!",1381104000,,{'Format:': ' Product Bundle'}
3,,True,"12 9, 2017",A1NRMZA5YUGW3Y,0545561647,Marci Rinehart,The concept for this is great but even I had a hard time with these. ,Cute idea,1512777600,,{'Format:': ' Product Bundle'}
5,,True,"10 23, 2017",A2LBN1U2ZSOOZU,0545561647,Kelly A. Kearns,This kit is so cute.  I have given it as gifts to two of my nieces!,Five Stars,1508716800,,{'Format:': ' Product Bundle'}
1,,True,"10 22, 2017",AR1CNW7TN6HNY,0545561647,K.  Romaner,"Horrible!
Nothing more to say
Would give zero stars if possible",Horrible! Nothing more to say Would give zero stars ...,1508630400,,{'Format:': ' Product Bundle'}
2,,True,"10 21, 2017",A243M6TBOHSP4H,0545561647,Ginger L. Ryall,"I sent this product to my granddaughter. The pom-pom maker comes in two parts and is supposed to snap together to create the pom-poms. However, both parts were the same making it unusable. If you can't make the pom-poms the kit is useless. Since this was sent as a gift, I do not have it to return. Very disappointed.",Faulty Product,1508544000,,{'Format:': ' Product Bundle'}
5,,True,"10 11, 2017",A2SITMHP0VTUIN,0545561647,Ruben P. Kim,Great product and clear instructions.,Five Stars,1507680000,,{'Format:': ' Product Bundle'}
3,,False,"08 20, 2017",A3N0QZZPFPOTR4,0545561647,momofkidsanddogs,"This kit was very frustrating and not at all something my 7-year-old could do on her own. The puppy turned out cute, but nothing like the photo. We also ran out of yarn, mid-project. The puppy took about 2 hours to complete.",but nothing like the photo,1503187200,,{'Format:': ' Product Bundle'}
4,,True,"08 18, 2017",A3C6T1060AMN0R,0545561647,Holly Cruse-Shepherd,"I'm 32 and really need a hobby, so I bought this kit. The instructions were easy to follow, my only tips are to have more yarn (I ran out of black on the first puppy) and use a hot glue gun. I did this based on other reviews, didn't even mess with the glue that was included.",Need more yarn & a hot glue gun,1503014400,['https://images-na.ssl-images-amazon.com/images/I/718eZpbiTWL._SY88.jpg'],{'Format:': ' Product Bundle'}
2,,True,"08 8, 2017",A1U4NOUWOCP8H2,0545561647,GW,"At age 31 I found these very difficult to make, I can't imagine how an 8 year old would do it by themselves.",At age 31 I found these very difficult to make ...,1502150400,,{'Format:': ' Product Bundle'}
2,,True,"08 2, 2017",A2LSN49OTWTU78,0545561647,W. Armstrong,"I double checked the contents to make sure everything was there but this was intended as a gift. The kit had obviously been opened and the packaging ripped. So it looks used and secondhand, which makes it a bit tacky to give as a gift. And as the instruction book is attached to the box, I can't repackage it myself. I'm giving it two stars because the kit does look fun bit in this case, it was a waste of money for me.",Box wasn't new,1501632000,,{'Format:': ' Product Bundle'}
3,,True,"07 31, 2017",A2O6VH77ZMZCAQ,0545561647,Amazon Customer,It's a cute project idea with easy to follow instructions. The pom pom maker works well and the materials seem quality. There is WAY too little yarn and other materials though. You can make two or three dogs tops depending on the colors you want to use and then you have to go searching for more yarn.,It's a cute project idea with easy to follow instructions,1501459200,,{'Format:': ' Product Bundle'}
4,,True,"07 25, 2017",A3I81XCUEJ75RN,0545561647,Doc Margy,We had a great time with this craft set.,Four Stars,1500940800,,{'Format:': ' Product Bundle'}
1,,True,"07 17, 2017",AWUPAM7C4GTWZ,0545561647,Jason,Incomplete kit!  Very disappointing!,INCOMPLETE KIT!,1500249600,,{'Format:': ' Product Bundle'}
1,,True,"07 4, 2017",A1CVNDBISROIAP,0545561647,Gaby U.,Incomplete set. Was missing the bead eyes the felt and a couple other things i was excited but was highly dissappointed that i was unable to do them,Incomplete,1499126400,,{'Format:': ' Product Bundle'}
4,,True,"06 10, 2017",A3RG3MC3E9EU1W,0545561647,R. Hughes,Nieces loved it.,Four Stars,1497052800,,{'Format:': ' Product Bundle'}
5,,True,"06 3, 2017",A1APR7NZTD7AQB,0545561647,Maria Beatriz Alessi,Kit and instructions make easy to learn the process. A basic video would be a nice resource as well.,Five Stars,1496448000,,{'Format:': ' Product Bundle'}
2,,True,"05 28, 2017",A2DOZ7ZQBMOQ2D,0545561647,M,Hard to put together.,"Cute idea, hard to do",1495929600,,{'Format:': ' Product Bundle'}
5,,True,"05 9, 2017",A3UIANT9G4O9FO,0545561647,Kandi Esslinger,"Great product. Took a little practice and time, but after you get the hang of it. It turns into a cute cuddly little friend. Mine didn't turn out exactly like the picture, but it adds a taste of your own sense of style. They are super cute and comes with everything it says it will.",Awesome,1494288000,,{'Format:': ' Product Bundle'}
1,,True,"05 4, 2017",A3OG7VNLL84IU,0545561647,Amazon Customer,Do not buy! They look cute. But my daughters could not do this on their own. It took a couple of adults reading the directions (multiple times) do be able to put only 1/2 of one together. It took so long that even I was over it. Ridiculous product!,Do not buy! They look cute. But my ...,1493856000,,{'Format:': ' Product Bundle'}
5,,True,"04 27, 2017",ALUX652JZJX1R,0545561647,Claudia J.,This is a fun craft project! I just wish I could buy refills of the collars and other add ons!,This is a fun craft project,1493251200,,{'Format:': ' Product Bundle'}
3,,True,"04 8, 2017",AQPRNOTQZVD62,0545561647,shopeen,Super cute but I ended up doing them myself. Too hard for my 6 yr old to do. Not sure what the age is on it...,Too hard for 6 yr old,1491609600,,{'Format:': ' Product Bundle'}
5,,True,"04 7, 2017",A2HHNO2T382683,0545561647,Rosemarie Reinman,Great item arrived in record time.  Birthday present for my granddaughter.  She love them.,Five Stars,1491523200,,{'Format:': ' Product Bundle'}
5,,True,"03 16, 2017",A2Q80KMX66E5BW,0545561647,Aelyn,Super cute crafts! My 10 and 12 year olds created darling puppies all by themselves.,Super cute!!,1489622400,,{'Format:': ' Product Bundle'}
3,2,True,"03 7, 2017",A33ESKAGJX0BC5,0545561647,Showmefirst,"I ran out of yarn, actually ran short while making the second Pom Pom for one dog. Don't even bother with the glue, just use your own from the start (Klutz is useless). The carrier is okay but too small so useless. The idea and presentation is charming and if easier it would be terrific for a slumber party! I wonder if there is an easier way to make a Pom Pom?",So promising but doesn't deliver,1488844800,,{'Format:': ' Product Bundle'}
5,,True,"03 4, 2017",A2D0AVXUJVHK1T,0545561647,Honest purchaser,Awesome gift,Five Stars,1488585600,,{'Format:': ' Product Bundle'}
3,3,True,"03 1, 2017",A1ZVZXZGOQAXUD,0545561647,MMC70,"It's okay. I would rate it as 10 and up . . . . it isn't easy to apply the ears and eyes and have them stay. It's definitely something that has to go on a shelf untouched after making. The yarn that comes with it will not make up many of these, so be prepared to go buy more yarn.",it isn't easy to apply the ears and eyes and have them ...,1488326400,,{'Format:': ' Product Bundle'}
3,,True,"02 24, 2017",A3UOSAXS8BM79N,0545561647,Karthik L,"This is a bit difficult. There are too many steps and we have to go back and forth to put the head , body together. If you are looking for something easy and fun , don't buy this. It will get you all wound up.",Did not like it,1487894400,,{'Format:': ' Product Bundle'}
2,,True,"02 23, 2017",A1I9B6F4Z82EJR,0545561647,Sagefemme,"Not very easy, just lots of yarn. Maybe for a 10 year old.",looks cuter that it is,1487808000,,{'Format:': ' Product Bundle'}
5,,True,"02 21, 2017",A74I9RE63LWLR,0545561647,Marti,Totally loved this kit! Easy enough to do.,Love it!,1487635200,,{'Format:': ' Product Bundle'}
5,,True,"02 18, 2017",A2U2QDVHGTE3Q5,0545561647,superbzmom,This is a fantastic product!  I highly recommend it for pretty much ANY age!,Great product!  Darling puppies!,1487376000,,{'Format:': ' Product Bundle'}
5,,True,"02 18, 2017",A1T2DNKLHYWP80,0545561647,Joan Parker,I ordered this for my granddaughter for Christmas and she loved it very much.,Pom Pom Puppies,1487376000,,{'Format:': ' Product Bundle'}
5,,True,"02 15, 2017",A37XNWFLWAZZ0B,0545561647,Inspired,Soooo cute and so much fun!  My non crafty husband made a puppy with each of my children (4 and 5) at Christmas and they turned out to be adorable and are still holding up!,Adorable and fun to make!,1487116800,,{'Format:': ' Product Bundle'}
5,,True,"02 7, 2017",AUJEOOAY70TXW,0545561647,C.,This gift was loved and the recipient created some very adorable little creatures using this kit!,Great!,1486425600,,{'Format:': ' Product Bundle'}
5,,True,"02 4, 2017",ACGZJB74QLDMA,0545561647,NJD,My niece has had so much fun with this.  She loves it.,Fun for a little girl,1486166400,,{'Format:': ' Product Bundle'}
5,,True,"01 27, 2017",A2ZJNB1VPAAR8C,0545561647,Amazon Customer,This is really fun.,Five Stars,1485475200,,{'Format:': ' Product Bundle'}
5,,True,"01 22, 2017",A2PTTZQ8UFQ78C,0545561647,Kindle Customer,Great craft day fun!,Fun,1485043200,,{'Format:': ' Product Bundle'}
5,,True,"01 22, 2017",A3LJ5XMQAZ3RMO,0545561647,Beth Ann,"Really cute!!! My 9yr old and I have made lots of pom poms. Best of all, theres no mess to clean up and it could be done in the car, etc too.  Love it!","Great craft, not too hard or time consuming, NO MESS! ",1485043200,,{'Format:': ' Product Bundle'}
2,,False,"01 21, 2017",A22E6809OJVHYD,0545561647,Daphne M. Caldwell,"Cute idea, and the basic steps make sense are are easy to follow if a parent works with the kid. I gave a low review because although my child was excited to take part in this, they get bored when you are doing the work ( trust me you will have to, my kid is in first grade) and the glue provided SUCKS. It's basically Elmers glue and it's just not enough to keep everything together. I can't keep the ears or anything to dry and stay on without falling off. I would recommend hot glue.",and the basic steps make sense are are easy to follow if a parent works with the kid,1484956800,,{'Format:': ' Product Bundle'}
1,,True,"01 17, 2017",A3SCMMOUFRA9VK,0545561647,carole jordan,BOOO  UNLES YOU ARE PATIENT KNOW HOW TO MEASURE I DIDN'T HAVE THE PATIENCE NEITHER DID MY DAUGHTER.  BORING UNLESS YOU ARE A CRAFT PERSON WHICH I AM NOT.,BORING UNLESS YOU ARE A CRAFT PERSON WHICH I AM ...,1484611200,,{'Format:': ' Product Bundle'}
4,,True,"01 15, 2017",A18T2S1Z2XJWHQ,0545561647,Amazon Customer,Had to help my 10 year old with the instructions.,Four Stars,1484438400,,{'Format:': ' Product Bundle'}
5,,False,"01 14, 2017",A27OP3TOSQXHRG,0545561647,Cohen Family,"I was skeptical, but my 9 year old has had so much fun with this kit and it was her favorite Christmas present.  She pretty much made the puppies herself with minimal help from me, though I did hot glue some ears rather than use the included glue.  Only downside is the cuttings can be messy, but really wonderful instructions, well-made supplies, and can be used for many years---and maybe even making different animals if you are creative.  Highly recommend for artsy, determined 9 year olds!  I actually want to try to make one myself they are so darn cute.",Awesome and well-designed for 9 year olds,1484352000,,{'Format:': ' Product Bundle'}
5,,True,"01 10, 2017",A99LHE8AEJ49,0545561647,Sandra Anfinson,Very cute and very well designed. Makes adorable puppies.,Makes adorable puppies.,1484006400,,{'Format:': ' Product Bundle'}
5,,True,"01 5, 2017",A2K5A1YC8SG6R8,0545561647,Amazon Customer,"Who doesn't love puppies. Great instructions, pictures. Fun.",Five Stars,1483574400,,{'Format:': ' Product Bundle'}
5,,True,"12 28, 2016",A1N5W56XX6AI8T,0545561647,Act II Books Puppets,Good stocking stuffer.,Five Stars,1482883200,,{'Format:': ' Product Bundle'}
5,,True,"12 21, 2016",AL4FEO5P4ZP4S,0545561647,Eez rants and raves,My 10 year old niece loved this!,Five Stars,1482278400,,{'Format:': ' Product Bundle'}
5,,False,"12 21, 2016",A1CL3SRDUAW7SK,0545561647,sparks,"I purchased this for my niece's 6th birthday, after her mom told me she'd seen it in a store and been interested. This is definitely a craft that needs adult assistance. Even for a bit older kids (9-10) who might be able to handle all the instructions on their own, there are parts where it's just easier to have a second person to help interpret the directions as the other person does the steps. I helped make the first puppy-- we figured out the directions for making the pom-poms without too much difficulty. Getting it the right shape can take a bit of trial-and-error, but it ends up looking fine even if the ""legs"" aren't as distinct, etc. The puppies are not a super sturdy toy, since they are glued together, but are cute for gently play or as decorations. I'd probably give 4.5 stars if that was an option, just due to that and the directions being a little tricky at first.","but it ends up looking fine even if the ""legs"" aren't as distinct",1482278400,,{'Format:': ' Product Bundle'}
5,,True,"12 21, 2016",AVMSTYQXSOFD4,0545561647,Amazon Customer,Great product!  Arrived on time.,Five Stars,1482278400,,{'Format:': ' Product Bundle'}
